Name,Type,CMC,Color Identity,Oracle Text,Keywords,Power,Toughness
"Jeska, Thrice Reborn",Jeska,3.0,R,"Jeska enters with a loyalty counter on her for each time you've cast a commander from the command zone this game.0: Choose target creature. Until your next turn, if that creature would deal combat damage to one of your opponents, it deals triple that damage to that player instead.−X: Jeska deals X damage to each of up to three targets.Jeska, Thrice Reborn can be your commander.Partner",Partner,0,0
"Jeska, Warrior Adept",Human Barbarian Warrior,4.0,R,"First strike, haste{T}: Jeska deals 1 damage to any target.","First strike, Haste",3,1
"Jessie Zane, Fangbringer",Human Assassin,3.0,G,"DeathtouchWhen Jessie Zane enters and whenever you cast a Snake spell, conjure a card named Ambush Viper into the top six cards of your library at random. It perpetually gains ""When this creature enters, draw a card.""","Conjure, Deathtouch",3,4
"Jetfire, Ingenious Scientist // Jetfire, Air Guardian",Robot // Legendary Artifact,5.0,U,Missing Oracle Text,"Flying, Adapt, Living metal, Convert, More Than Meets the Eye",0,0
Jin-Gitaxias // The Great Synthesis,Phyrexian Praetor // Enchantment,5.0,U,Missing Oracle Text,"Transform, Ward",0,0
"Jiwari, the Earth Aflame",Spirit,5.0,R,"{X}{R}, {T}: Jiwari deals X damage to target creature without flying.Channel — {X}{R}{R}{R}, Discard this card: It deals X damage to each creature without flying.",Channel,3,3
Jo Grant,Human Soldier,3.0,W,"Each historic card in your hand has cycling {2}{W}. ({2}{W}, Discard that card: Draw a card.)Whenever you cycle a card, put a +1/+1 counter on Jo Grant.Doctor's companion (You can have two commanders if the other is the Doctor.)",Doctor's companion,3,2
Johan,Human Wizard,6.0,"G, R, W","At the beginning of combat on your turn, you may have Johan gain ""Johan can't attack"" until end of combat. If you do, attacking doesn't cause creatures you control to tap this combat if Johan is untapped.",,5,4
"Johann, Apprentice Sorcerer",Human Wizard,4.0,"R, U","You may look at the top card of your library any time.Once each turn, you may cast an instant or sorcery spell from the top of your library. (You still pay its costs. Timing rules still apply.)",,2,5
"Johnny, Combo Player",Human Gamer,4.0,U,"{4}: Search your library for a card, put that card into your hand, then shuffle.",,1,1
"Jolene, Plundering Pugilist",Human Mercenary,3.0,"G, R","Whenever you attack with one or more creatures with power 4 or greater, create a Treasure token.{1}{R}, Sacrifice a Treasure: Jolene deals 1 damage to any target.",Treasure,4,2
"Jon Irenicus, the Exile",Elf Wizard,4.0,"B, U","At the beginning of your end step, draw a card if your library has more cards in it than target opponent's library. Otherwise, each opponent mills five cards.",Mill,3,5
"Jor Kadeen, the Prevailer",Human Warrior,5.0,"R, W",First strikeMetalcraft — Creatures you control get +3/+0 as long as you control three or more artifacts.,"Metalcraft, First strike",5,4
"Jorn, God of Winter // Kaldring, the Rimestaff",God // Legendary Snow Artifact,3.0,"B, G, U",Missing Oracle Text,,0,0
"Josu Vess, Lich Knight",Zombie Knight,4.0,B,"Kicker {5}{B} (You may pay an additional {5}{B} as you cast this spell.)MenaceWhen Josu Vess enters, if it was kicked, create eight 2/2 black Zombie Knight creature tokens with menace.","Menace, Kicker",4,5
Joven,Human Rogue,5.0,R,"{R}{R}{R}, {T}: Destroy target noncreature artifact.",,3,3
"Jugan, the Rising Star",Dragon Spirit,6.0,G,"FlyingWhen Jugan dies, you may distribute five +1/+1 counters among any number of target creatures.",Flying,5,5
"Junji, the Midnight Sky",Dragon Spirit,5.0,B,"Flying, menaceWhen Junji dies, choose one —• Each opponent discards two cards and loses 2 life.• Put target non-Dragon creature card from a graveyard onto the battlefield under your control. You lose 2 life.","Flying, Menace",5,5
"K-9, Mark I",Robot Dog,1.0,U,"Negative — As long as K-9 is untapped, other legendary creatures you control have ward {1}.Affirmative — {1}{U}, {T}: Target legendary creature can't be blocked this turn.Doctor's companion (You can have two commanders if the other is the Doctor.)","Negative, Affirmative, Doctor's companion",1,1
"Kaervek, the Spiteful",Human Warlock,4.0,B,Other creatures get -1/-1.,,3,2
"Kagemaro, First to Suffer",Demon Spirit,5.0,B,"Kagemaro's power and toughness are each equal to the number of cards in your hand.{B}, Sacrifice Kagemaro: All creatures get -X/-X until end of turn, where X is the number of cards in your hand.",,0,0
"Kagha, Shadow Archdruid",Elf Druid,4.0,"B, G","Whenever Kagha attacks, it gains deathtouch until end of turn. Mill two cards. (Put the top two cards of your library into your graveyard.)Once during each of your turns, you may play a land or cast a permanent spell from among cards in your graveyard that were put there from your library this turn.",Mill,1,4
"Kaho, Minamo Historian",Human Wizard,4.0,U,"When Kaho enters, search your library for up to three instant cards, exile them, then shuffle.{X}, {T}: You may cast a spell with mana value X from among cards exiled with Kaho without paying its mana cost.",,2,2
"Kairi, the Swirling Sky",Dragon Spirit,6.0,U,"Flying, ward {3}When Kairi dies, choose one —• Return any number of target nonland permanents with total mana value 6 or less to their owners' hands.• Mill six cards, then return up to two instant and/or sorcery cards from your graveyard to your hand.","Flying, Ward, Mill",6,6
"Kalain, Reclusive Painter",Human Elf Bard,2.0,"B, R","When Kalain enters, create a Treasure token. (It's an artifact with ""{T}, Sacrifice this token: Add one mana of any color."")Other creatures you control enter with an additional +1/+1 counter on them for each mana from a Treasure spent to cast them.",Treasure,1,2
"Kalakscion, Hunger Tyrant",Crocodile,3.0,B,,,7,2
"Kalitas, Bloodchief of Ghet",Vampire Warrior,7.0,B,"{B}{B}{B}, {T}: Destroy target creature. If that creature dies this way, create a black Vampire creature token. Its power is equal to that creature's power and its toughness is equal to that creature's toughness.",,5,5
"Kalitas, Traitor of Ghet",Vampire Warrior,4.0,B,"LifelinkIf a nontoken creature an opponent controls would die, instead exile that card and create a 2/2 black Zombie creature token.{2}{B}, Sacrifice another Vampire or Zombie: Put two +1/+1 counters on Kalitas.",Lifelink,3,4
"Kamachal, Ship's Mascot",Dinosaur Pirate,3.0,R,"Menace{R}: Kamachal, Ship's Mascot gets +1/+0 until end of turn.Whenever Kamachal deals combat damage to a player, create a Treasure token. Then exile from that player's library a random card with mana value equal to the damage dealt. You may cast that card this turn.","Treasure, Menace",2,2
"Kamahl, Pit Fighter",Human Barbarian,6.0,R,Haste (This creature can attack and {T} as soon as it comes under your control.){T}: Kamahl deals 3 damage to any target.,Haste,6,1
"Kamber, the Plunderer",Vampire Rogue,4.0,B,"Partner with Laurine, the Diversion (When this creature enters, target player may put Laurine into their hand from their library, then shuffle.)LifelinkWhenever a creature an opponent controls dies, you gain 1 life and create a Blood token. (It's an artifact with ""{1}, {T}, Discard a card, Sacrifice this token: Draw a card."")","Lifelink, Partner with, Partner",3,4
"Kardum, Patron of Flames",Demon,4.0,R,"HasteWhenever Kardum, Patron of Flames attacks, put a flame counter on it, then seek a card with mana value equal to the number of flame counters on it and exile that card face down.When Kardum dies, put all cards you own exiled with it into your hand. At the beginning of the end step of your next turn, discard those cards.","Seek, Haste",4,3
"Kari Zev, Crew of Two",Human Pirate,4.0,R,"Menace, HasteWhenever Kari Zev attacks while you don't control a legendary Monkey, conjure a card named Ragavan, Nimble Pilferer onto the battlefield tapped and attacking. At the beginning of the next end step, if that card is on the battlefield, return it to its owner's hand.","Haste, Menace, Conjure",3,3
"Kari Zev, Skyship Raider",Human Pirate,2.0,R,"First strike, menaceWhenever Kari Zev attacks, create Ragavan, a legendary 2/1 red Monkey creature token. Ragavan enters tapped and attacking. Exile that token at end of combat.","First strike, Menace",1,3
"Karlach, Raging Tiefling",Tiefling Barbarian,2.0,R,"First strikeRage Beyond Death — Specialize {6}. You may also activate this ability if Karlach, Raging Tiefling is in your graveyard.","First strike, Rage Beyond Death, Specialize",2,2
"Karvanista, Loyal Lupari // Lupari Shield",Alien Dog Soldier // Sorcery,5.0,G,Missing Oracle Text,"Vigilance, Haste, Trample",5,5
Kasimir the Lone Wolf,Human Warrior,6.0,"U, W",,,5,3
"Kassandra, Eagle Bearer",Human Assassin Warrior,3.0,"R, W","HasteWhen Kassandra enters, search your graveyard, hand, and library for a card named The Spear of Leonidas, put it onto the battlefield, then shuffle.Whenever a creature you control with a legendary Equipment attached to it deals combat damage to a player, draw a card.",Haste,2,2
"Kataki, War's Wage",Spirit,2.0,W,"All artifacts have ""At the beginning of your upkeep, sacrifice this artifact unless you pay {1}.""",,2,1
Katerina of Myra's Marvels,Human Performer,4.0,W,"As Katerina of Myra's Marvels enters, choose a letter.Whenever you cast a spell whose name begins with the chosen letter, create a white 2/2 Cat creature token with flying.Partner (You can have two commanders if they both have partner.)",Partner,3,3
"Katilda, Dawnhart Martyr // Katilda's Rising Dawn",Spirit Warlock // Legendary Enchantment,3.0,W,Missing Oracle Text,"Flying, Lifelink, Transform, Protection, Enchant, Disturb",0,0
"Kazarov, Sengir Pureblood",Vampire,7.0,"B, R","FlyingWhenever a creature an opponent controls is dealt damage, put a +1/+1 counter on Kazarov.{3}{R}: Kazarov deals 2 damage to target creature.",Flying,4,4
"Kazuul, Tyrant of the Cliffs",Ogre Warrior,5.0,R,"Whenever a creature an opponent controls attacks, if you're the defending player, create a 3/3 red Ogre creature token unless that creature's controller pays {3}.",,5,4
Kefnet the Mindful,God,3.0,U,"Flying, indestructibleKefnet can't attack or block unless you have seven or more cards in hand.{3}{U}: Draw a card, then you may return a land you control to its owner's hand.","Flying, Indestructible",5,5
"Keleth, Sunmane Familiar",Horse,2.0,W,"Whenever a commander you control attacks, put a +1/+1 counter on it.Partner (You can have two commanders if both have partner.)",Partner,1,1
"Kellan, Daring Traveler // Journey On",Human Faerie Scout // Sorcery,2.0,"G, W",Missing Oracle Text,,2,3
"Kellan, Inquisitive Prodigy // Tail the Suspect",Human Faerie Detective // Sorcery,4.0,"G, U",Missing Oracle Text,"Flying, Investigate, Vigilance",3,4
"Kellan, Planar Trailblazer",Human Faerie Scout,1.0,R,"{1}{R}: If Kellan is a Scout, it becomes a Human Faerie Detective and gains ""Whenever Kellan deals combat damage to a player, exile the top card of your library. You may play that card this turn.""{2}{R}: If Kellan is a Detective, it becomes a 3/2 Human Faerie Rogue and gains double strike.",,2,1
"Kellan, the Fae-Blooded // Birthright Boon",Human Faerie // Sorcery,3.0,"R, W",Missing Oracle Text,Double strike,2,2
"Kels, Fight Fixer",Azra Warlock,4.0,"B, U","MenaceWhenever you sacrifice a creature, you may pay {U/B}. If you do, draw a card. ({U/B} can be paid with either {U} or {B}.){1}, Sacrifice a creature: Kels gains indestructible until end of turn.",Menace,4,3
"Keruga, the Macrosage",Dinosaur Hippo,5.0,"G, U","Companion — Your starting deck contains only cards with mana value 3 or greater and land cards. (If this card is your chosen companion, you may put it into your hand from outside the game for {3} as a sorcery.)When Keruga enters, draw a card for each other permanent you control with mana value 3 or greater.",Companion,5,4
"Keskit, the Flesh Sculptor",Phyrexian Human Artificer,3.0,B,"{T}, Sacrifice three other artifacts and/or creatures: Look at the top three cards of your library. Put two of them into your hand and the other into your graveyard.Partner (You can have two commanders if both have partner.)",Partner,1,3
"Kestia, the Cultivator",Nymph,4.0,"G, U, W","Bestow {3}{G}{W}{U} (If you cast this card for its bestow cost, it's an Aura spell with enchant creature. It becomes a creature again if it's not attached to a creature.)Enchanted creature gets +4/+4.Whenever an enchanted creature or enchantment creature you control attacks, draw a card.",Bestow,4,4
Khorvath Brightflame,Dragon,6.0,R,"Partner with Sylvia Brightspear (When this creature enters, target player may put Sylvia into their hand from their library, then shuffle.)Flying, hasteKnights your team controls have flying and haste.","Flying, Partner with, Haste, Partner",3,4
"Kianne, Dean of Substance // Imbraham, Dean of Theory",Elf Druid // Legendary Creature,3.0,"G, U",Missing Oracle Text,Flying,0,0
"Kiki-Jiki, Mirror Breaker",Goblin Shaman,5.0,R,"Haste{T}: Create a token that's a copy of target nonlegendary creature you control, except it has haste. Sacrifice it at the beginning of the next end step.",Haste,2,2
"Kiku, Night's Flower",Human Assassin,2.0,B,"{2}{B}{B}, {T}: Target creature deals damage to itself equal to its power.",,1,1
Kinzu of the Bleak Coven,Phyrexian Vampire,5.0,B,"FlyingWhenever another nontoken creature you control dies, you may pay 2 life and exile it. If you do, create a token that's a copy of that creature, except it's 1/1 and has toxic 1. (Players dealt combat damage by it also get a poison counter.)",Flying,5,4
"Kiora, the Rising Tide",Merfolk Noble,3.0,U,"When Kiora enters, draw two cards, then discard two cards.Threshold — Whenever Kiora attacks, if there are seven or more cards in your graveyard, you may create Scion of the Deep, a legendary 8/8 blue Octopus creature token.",Threshold,3,2
"Kira, Great Glass-Spinner",Spirit,3.0,U,"FlyingCreatures you control have ""Whenever this creature becomes the target of a spell or ability for the first time each turn, counter that spell or ability.""",Flying,2,2
"Kiyomaro, First to Stand",Spirit,5.0,W,"Kiyomaro's power and toughness are each equal to the number of cards in your hand.As long as you have four or more cards in hand, Kiyomaro has vigilance.Whenever Kiyomaro deals damage, if you have seven or more cards in hand, you gain 7 life.",,0,0
"Klement, Novice Acolyte",Tiefling Cleric,2.0,W,"Specialize {2}When Klement, Novice Acolyte enters, creature cards in your hand perpetually get +1/+1.",Specialize,2,2
Kodama of the East Tree,Spirit,6.0,G,"ReachWhenever another permanent you control enters, if it wasn't put onto the battlefield with this ability, you may put a permanent card with equal or lesser mana value from your hand onto the battlefield.Partner (You can have two commanders if both have partner.)","Reach, Partner",6,6
Kodama of the North Tree,Spirit,5.0,G,TrampleShroud (This creature can't be the target of spells or abilities.),"Shroud, Trample",6,4
"Kokusho, the Evening Star",Dragon Spirit,6.0,B,"FlyingWhen Kokusho dies, each opponent loses 5 life. You gain life equal to the life lost this way.",Flying,5,5
"Kolaghan, the Storm's Fury",Dragon,5.0,"B, R","FlyingWhenever a Dragon you control attacks, creatures you control get +1/+0 until end of turn.Dash {3}{B}{R} (You may cast this spell for its dash cost. If you do, it gains haste, and it's returned from the battlefield to its owner's hand at the beginning of the next end step.)","Flying, Dash",4,5
"Kolvori, God of Kinship // The Ringhart Crest",God // Legendary Artifact,4.0,G,Missing Oracle Text,,0,0
"Koma, World-Eater",Serpent,7.0,"G, U","This spell can't be countered.Trample, ward {4}Whenever Koma deals combat damage to a player, create four 3/3 blue Serpent creature tokens named Koma's Coil.","Trample, Ward",8,12
"Korlash, Heir to Blackblade",Zombie Warrior,4.0,B,"Korlash's power and toughness are each equal to the number of Swamps you control.{1}{B}: Regenerate Korlash.Grandeur — Discard another card named Korlash, Heir to Blackblade: Search your library for up to two Swamp cards, put them onto the battlefield tapped, then shuffle.",Grandeur,0,0
"Korlessa, Scale Singer",Dragon Bard,2.0,"G, U",You may look at the top card of your library any time.You may cast Dragon spells from the top of your library.,,1,4
"Kothophed, Soul Hoarder",Demon,6.0,B,"FlyingWhenever a permanent owned by another player is put into a graveyard from the battlefield, you draw a card and you lose 1 life.",Flying,6,6
"Kotis, Sibsig Champion",Zombie Warrior,3.0,"B, G, U","Once during each of your turns, you may cast a creature spell from your graveyard by exiling three other cards from your graveyard in addition to paying its other costs.Whenever one or more creatures you control enter, if one or more of them entered from a graveyard or was cast from a graveyard, put two +1/+1 counters on Kotis.",,3,3
"Kotis, the Fangkeeper",Zombie Warrior,4.0,"B, G, U","IndestructibleWhenever Kotis deals combat damage to a player, exile the top X cards of their library, where X is the amount of damage dealt. You may cast any number of spells with mana value X or less from among them without paying their mana costs.",Indestructible,2,1
"Kozilek, the Broken Reality",Eldrazi,9.0,No Color Identity,"When you cast this spell, up to two target players each manifest two cards from their hands. For each card manifested this way, you draw a card. (To manifest a card, put it onto the battlefield face down as a 2/2 creature. Turn it face up any time for its mana cost if it's a creature card.)Other colorless creatures you control get +3/+2.",Manifest,9,9
"Kraum, Ludevic's Opus",Zombie Horror,5.0,"R, U","Flying, hasteWhenever an opponent casts their second spell each turn, draw a card.Partner (You can have two commanders if both have partner.)","Flying, Haste, Partner",4,4
"Kraum, Violent Cacophony",Zombie Horror,4.0,"R, U","FlyingWhenever you cast your second spell each turn, put a +1/+1 counter on Kraum and draw a card.",Flying,2,3
"Krav, the Unredeemed",Demon,5.0,B,"Partner with Regna, the Redeemer (When this creature enters, target player may put Regna into their hand from their library, then shuffle.){B}, Sacrifice X creatures: Target player draws X cards and gains X life. Put X +1/+1 counters on Krav.","Partner with, Partner",3,3
Krond the Dawn-Clad,Archon,6.0,"G, W","Flying, vigilanceWhenever Krond attacks, if it's enchanted, exile target permanent.","Flying, Vigilance",6,6
"Kumano, Master Yamabushi",Human Shaman,5.0,R,"{1}{R}: Kumano deals 1 damage to any target.If a creature dealt damage by Kumano this turn would die, exile it instead.",,4,4
"Kuon, Ogre Ascendant // Kuon's Essence",Ogre Monk // Legendary Enchantment,3.0,B,Missing Oracle Text,,2,4
"Kuro, Pitlord",Demon Spirit,9.0,B,"At the beginning of your upkeep, sacrifice Kuro unless you pay {B}{B}{B}{B}.Pay 1 life: Target creature gets -1/-1 until end of turn.",,9,9
"Kydele, Chosen of Kruphix",Human Wizard,4.0,"G, U",{T}: Add {C} for each card you've drawn this turn.Partner (You can have two commanders if both have partner.),Partner,2,3
"Kykar, Zephyr Awakener",Bird Wizard,4.0,"U, W","FlyingWhenever you cast a noncreature spell, choose one —• Exile another target creature you control. Return that card to the battlefield under its owner's control at the beginning of the next end step.• Create a 1/1 white Spirit creature token with flying.",Flying,3,4
"Kylox, Visionary Inventor",Lizard Artificer,7.0,"R, U","Menace, ward {2}, hasteWhenever Kylox attacks, sacrifice any number of other creatures, then exile the top X cards of your library, where X is their total power. You may cast any number of instant and/or sorcery spells from among the exiled cards without paying their mana costs.","Haste, Menace, Ward",4,4
"Kyoki, Sanity's Eclipse",Demon Spirit,6.0,B,"Whenever you cast a Spirit or Arcane spell, target opponent exiles a card from their hand.",,6,4
"Kytheon, Hero of Akros // Gideon, Battle-Forged",Human Soldier // Legendary Planeswalker,1.0,W,Missing Oracle Text,Transform,0,0
Lady Sun,Human Advisor,3.0,U,"{T}: Return Lady Sun and another target creature to their owners' hands. Activate only during your turn, before attackers are declared.",,1,1
"Lady Zhurong, Warrior Queen",Human Soldier Warrior,5.0,G,Horsemanship (This creature can't be blocked except by creatures with horsemanship.),Horsemanship,4,3
"Lae'zel, Githyanki Warrior",Gith Warrior,4.0,W,"Double strikeSpecialize {1}When you cast this spell, it gains ""When this creature becomes the target of a spell or ability an opponent controls, you may exile this creature, then return it to the battlefield under its owner's control.""","Double strike, Specialize",2,4
"Lae'zel, Vlaakith's Champion",Gith Warrior,3.0,W,"If you would put one or more counters on a creature or planeswalker you control or on yourself, put that many plus one of each of those kinds of counters on that permanent or player instead.Choose a Background (You can have a Background as a second commander.)",Choose a background,3,3
"Landroval, Horizon Witness",Bird Noble,5.0,W,"FlyingWhenever two or more creatures you control attack a player, target attacking creature without flying gains flying until end of turn.",Flying,3,4
"Latulla, Keldon Overseer",Human Spellshaper,5.0,R,"{X}{R}, {T}, Discard two cards: Latulla deals X damage to any target.",,3,3
"Laurine, the Diversion",Human Rogue,3.0,R,"Partner with Kamber, the Plunderer (When this creature enters, target player may put Kamber into their hand from their library, then shuffle.)First strike{2}, Sacrifice an artifact or creature: Goad target creature. (Until your next turn, that creature attacks each combat if able and attacks a player other than you if able.)","Partner with, Goad, First strike, Partner",3,3
Lavinia of the Tenth,Human Soldier,5.0,"U, W","Protection from redWhen Lavinia enters, detain each nonland permanent your opponents control with mana value 4 or less. (Until your next turn, those permanents can't attack or block and their activated abilities can't be activated.)","Protection, Detain",4,4
Layla Hassan,Human Assassin,4.0,W,"First strikeWhen Layla Hassan enters and whenever one or more Assassins you control deal combat damage to a player, return target historic card from your graveyard to your hand.",First strike,3,4
"Leela, Sevateem Warrior",Human Warrior,4.0,G,"Whenever an opponent draws a card except the first one they draw in each of their draw steps, put a +1/+1 counter on Leela.Doctor's companion (You can have two commanders if the other is the Doctor.)",Doctor's companion,3,3
"Legate Lanius, Caesar's Ace",Human Soldier,4.0,"B, R","Decimate — When Legate Lanius enters, each opponent sacrifices a tenth of the creatures they control of their choice, rounded up.Whenever an opponent sacrifices a creature, put a +1/+1 counter on Legate Lanius.",Decimate,2,2
Legolas Greenleaf,Elf Archer,3.0,G,"ReachLegolas can't be blocked by creatures with power 2 or less.Whenever another legendary creature you control enters, put a +1/+1 counter on Legolas.Whenever Legolas deals combat damage to a player, draw a card.",Reach,2,2
"Lena, Selfless Champion",Human Knight,6.0,W,"When Lena enters, create a 1/1 white Soldier creature token for each nontoken creature you control.Sacrifice Lena: Creatures you control with power less than Lena's power gain indestructible until end of turn.",,3,3
Liara of the Flaming Fist,Human Soldier,2.0,"R, W","At the beginning of each combat, each creature you control gets +1/+1 until end of turn if it has the same name as another creature you control or a creature card in your graveyard.{1}{R}{W}: Another target nontoken creature you control gains first strike and double team until end of turn. Activate only as a sorcery and only once.",,2,2
Lieutenant Kirtar,Bird Soldier,3.0,W,"Flying{1}{W}, Sacrifice Lieutenant Kirtar: Exile target attacking creature.",Flying,2,2
"Lila, Hospitality Hostess",Elf Employee,4.0,"G, W",You may look at the top card of your library any time.You may cast common spells from the top of your library.Guests you control get +1/+1.,,3,3
"Liliana, Heretical Healer // Liliana, Defiant Necromancer",Human Cleric // Legendary Planeswalker,3.0,B,Missing Oracle Text,"Lifelink, Transform",0,0
"Lily Bowen, Raging Grandma",Mutant Warrior,4.0,G,"VigilanceLily Bowen enters with two +1/+1 counters on it.At the beginning of your upkeep, double the number of +1/+1 counters on Lily Bowen if its power is 16 or less. Otherwise, remove all but one +1/+1 counter from it, then you gain 1 life for each +1/+1 counter removed this way.",Vigilance,0,0
Lim-Dul the Necromancer,Human Wizard,7.0,B,"Whenever a creature an opponent controls dies, you may pay {1}{B}. If you do, return that card to the battlefield under your control. If it's a creature, it's a Zombie in addition to its other creature types.{1}{B}: Regenerate target Zombie.",,4,4
"Linessa, Zephyr Mage",Human Wizard,4.0,U,"{X}{U}{U}, {T}: Return target creature with mana value X to its owner's hand.Grandeur — Discard another card named Linessa, Zephyr Mage: Target player returns a creature they control to its owner's hand, then repeats this process for an artifact, an enchantment, and a land.",Grandeur,3,3
"Linvala, Keeper of Silence",Angel,4.0,W,FlyingActivated abilities of creatures your opponents control can't be activated.,Flying,3,4
"Liu Bei, Lord of Shu",Human Soldier,5.0,W,"Horsemanship (This creature can't be blocked except by creatures with horsemanship.)Liu Bei gets +2/+2 as long as you control a permanent named Guan Yu, Sainted Warrior or a permanent named Zhang Fei, Fierce Warrior.",Horsemanship,2,4
