Name,Type,CMC,Color Identity,Oracle Text,Keywords,Power,Toughness
Rose Tyler,Human,2.0,W,"Rose Tyler gets +1/+1 for each time counter on it.Bad Wolf — Whenever Rose Tyler attacks, put a time counter on it for each suspended card you own and each other permanent you control with a time counter on it.Doctor's companion (You can have two commanders if the other is the Doctor.)","Bad Wolf, Doctor's companion",2,2
Rosie Cotton of South Lane,Halfling Peasant,3.0,W,"When Rosie Cotton enters, create a Food token. (It's an artifact with ""{2}, {T}, Sacrifice this token: You gain 3 life."")Whenever you create a token, put a +1/+1 counter on target creature you control other than Rosie Cotton.",Food,1,1
"Rothga, Bonded Engulfer",Phyrexian Beast,4.0,G,"TrampleWhen Rothga, Bonded Engulfer enters, you get a one-time boon with ""When you cast a creature spell, it perpetually gets +X/+X, where X is its power.""",Trample,4,4
Rowan Kenrith,Rowan,6.0,R,"+2: During target player's next turn, each creature that player controls attacks if able.−2: Rowan Kenrith deals 3 damage to each tapped creature target player controls.−8: Target player gets an emblem with ""Whenever you activate an ability that isn't a mana ability, copy it. You may choose new targets for the copy.""Partner with Will KenrithRowan Kenrith can be your commander.","Partner with, Partner",0,0
"Runadi, Behemoth Caller",Cat Shaman,3.0,G,"Whenever you cast a creature spell with mana value 5 or greater, that creature enters with X additional +1/+1 counters on it, where X is its mana value minus 4.Creatures you control with three or more +1/+1 counters on them have haste.{T}: Add {G}.",,1,3
"Rune-Tail, Kitsune Ascendant // Rune-Tail's Essence",Fox Monk // Legendary Enchantment,3.0,W,Missing Oracle Text,,2,2
"Runo Stromkirk // Krothuss, Lord of the Deep",Vampire Cleric // Legendary Creature,3.0,"B, U",Missing Oracle Text,"Flying, Transform",0,0
"Rusko, Clockmaker",Human Artificer,4.0,"B, U","When Rusko, Clockmaker enters the battlefield, conjure a card named Midnight Clock onto the battlefield.Whenever you cast a noncreature spell, put an hour counter on each permanent you control named Midnight Clock. Each opponent loses 1 life and you gain 1 life.",Conjure,3,3
Ryan Sinclair,Human,3.0,R,"Whenever Ryan attacks, exile cards from the top of your library until you exile a nonland card. You may cast the exiled card without paying its mana cost if it's a spell with mana value less than or equal to Ryan's power. Put the exiled cards not cast this way on the bottom of your library in a random order.Doctor's companion (You can have two commanders if the other is the Doctor.)",Doctor's companion,2,2
"Ryusei, the Falling Star",Dragon Spirit,6.0,R,"FlyingWhen Ryusei dies, it deals 5 damage to each creature without flying.",Flying,5,5
"Safana, Calimport Cutthroat",Human Rogue,3.0,B,"MenaceAt the beginning of your end step, if you have the initiative, create a Treasure token. Create three of those tokens instead if you've completed a dungeon.Choose a Background (You can have a Background as a second commander.)","Choose a background, Treasure, Menace",3,2
Saffi Eriksdotter,Human Scout,2.0,"G, W","Sacrifice Saffi Eriksdotter: When target creature is put into your graveyard this turn, return that card to the battlefield.",,2,2
Saint Elenda,Vampire Cleric,7.0,W,"LifelinkWhen Saint Elenda enters, conjure a card of your choice from Saint Elenda's spellbook into your hand. You may cast that card this turn without paying its mana cost.At the beginning of your end step, if you gained life this turn, create an X/X white Avatar creature token, where X is the amount of life you gained this turn.","Lifelink, Conjure",4,7
Sakashima of a Thousand Faces,Human Rogue,4.0,U,"You may have Sakashima enter as a copy of another creature you control, except it has Sakashima's other abilities.The ""legend rule"" doesn't apply to permanents you control.Partner (You can have two commanders if both have partner.)",Partner,3,1
"Sala, Deck Boss",Squid Pirate,3.0,"R, U","Each creature you control with an exhaust ability has haste.Whenever you activate an exhaust ability that isn't a mana ability, copy it. You may choose new targets for the copy.",,3,3
Sally Sparrow,Human Detective,4.0,"U, W","You may cast creature spells as though they had flash.Whenever one or more other creatures you control leave the battlefield, investigate. This ability triggers only once each turn. (Create a Clue token. It's an artifact with ""{2}, Sacrifice this token: Draw a card."")",Investigate,2,3
Samwise the Stouthearted,Halfling Peasant,2.0,W,"FlashWhen Samwise enters, choose up to one target permanent card in your graveyard that was put there from the battlefield this turn. Return it to your hand. Then the Ring tempts you.",Flash,2,1
"Sanwell, Avenger Ace",Human Pilot,2.0,W,"As long as an artifact creature you control is attacking, prevent all damage that would be dealt to Sanwell.Whenever Sanwell becomes tapped, exile the top six cards of your library. You may cast a Vehicle or artifact creature spell from among them. Then put the rest on the bottom of your library in a random order.",,3,1
"Saradoc, Master of Buckland",Halfling Citizen,4.0,W,"Whenever Saradoc or another nontoken creature you control with power 2 or less enters, create a 1/1 white Halfling creature token.Tap two other untapped Halflings you control: Saradoc gets +2/+0 and gains lifelink until end of turn.",,2,4
Sarah Jane Smith,Human Detective,2.0,W,"Whenever you cast a historic spell, investigate. This ability triggers only once each turn. (Artifacts, legendaries, and Sagas are historic. To investigate, create a Clue token. It's an artifact with ""{2}, Sacrifice this token: Draw a card."")Doctor's companion (You can have two commanders if the other is the Doctor.)","Investigate, Doctor's companion",2,1
"Sarevok, Deathbringer",Human Knight,4.0,B,"At the beginning of each player's end step, if no permanents left the battlefield this turn, that player loses X life, where X is Sarevok's power.Choose a Background (You can have a Background as a second commander.)",Choose a background,3,4
Sarevok the Usurper,Human Knight,4.0,B,"Specialize {3}At the beginning of combat on your turn, target creature you control gets +X/+0 until end of turn, where X is the number of creature cards in your graveyard.",Specialize,3,3
"Sarkhan, Dragon Ascendant",Human Druid,2.0,R,"When Sarkhan enters, you may behold a Dragon. If you do, create a Treasure token. (To behold a Dragon, choose a Dragon you control or reveal a Dragon card from your hand.)Whenever a Dragon you control enters, put a +1/+1 counter on Sarkhan. Until end of turn, Sarkhan becomes a Dragon in addition to its other types and gains flying.",Treasure,2,2
Saruman the White,Avatar Wizard,5.0,U,"Ward {2}Whenever you cast your second spell each turn, amass Orcs 2. (Put two +1/+1 counters on an Army you control. It's also an Orc. If you don't control an Army, create a 0/0 black Orc Army creature token first.)","Amass, Ward",4,4
"Sasaya, Orochi Ascendant // Sasaya's Essence",Snake Monk // Legendary Enchantment,3.0,G,Missing Oracle Text,,2,3
Scion of Halaster,Background,2.0,B,"Commander creatures you own have ""The first time you would draw a card each turn, instead look at the top two cards of your library. Put one of them into your graveyard and the other back on top of your library. Then draw a card.""",,0,0
"Seizan, Perverter of Truth",Demon Spirit,5.0,B,"At the beginning of each player's upkeep, that player loses 2 life and draws two cards.",,6,5
Senator Peacock,Human Advisor,5.0,U,"Artifacts you control are Clues in addition to their other types and have ""{2}, Sacrifice this artifact: Draw a card.""Whenever you sacrifice a Clue, target creature can't be blocked this turn.",,3,4
"Sengir, the Dark Baron",Vampire Noble,6.0,B,"FlyingWhenever another creature dies, put two +1/+1 counters on Sengir.Whenever another player loses the game, you gain life equal to that player's life total as the turn began.Partner (You can have two commanders if both have partner.)","Flying, Partner",4,4
Sensational Spider-Man,Spider Human Hero,3.0,"U, W","Whenever Sensational Spider-Man attacks, tap target creature defending player controls and put a stun counter on it. Then you may remove up to three stun counters from among all permanents. Draw cards equal to the number of stun counters removed this way.",,3,3
Sentinel Sarah Lyons,Human Knight,5.0,"R, W","HasteAs long as an artifact entered the battlefield under your control this turn, creatures you control get +2/+2.Battalion — Whenever Sentinel Sarah Lyons and at least two other creatures attack, Sentinel Sarah Lyons deals damage equal to the number of artifacts you control to target player.","Battalion, Haste",4,4
"Senu, Keen-Eyed Protector",Bird Scout,2.0,W,"Flying, vigilance{T}, Exile Senu: You gain 2 life and scry 2.When a legendary creature you control attacks and isn't blocked, if this card is exiled, put it onto the battlefield attacking.","Scry, Flying, Vigilance",2,1
"Sephiroth, Planet's Heir",Human Avatar Soldier,6.0,"B, U","Vigilance (Attacking doesn't cause this creature to tap.)When Sephiroth enters, creatures your opponents control get -2/-2 until end of turn.Whenever a creature an opponent controls dies, put a +1/+1 counter on Sephiroth.",Vigilance,4,4
"Shabraz, the Skyshark",Shark Bird,5.0,"U, W","Partner with Brallin, Skyshark RiderFlyingWhenever you draw a card, put a +1/+1 counter on Shabraz and you gain 1 life.{W/U}: Target Human gains flying until end of turn.","Flying, Partner with, Partner",3,3
"Shadowheart, Dark Justiciar",Human Elf Cleric,4.0,B,"{1}{B}, {T}, Sacrifice another creature: Draw X cards, where X is that creature's power.Choose a Background (You can have a Background as a second commander.)",Choose a background,3,4
"Shadowheart, Sharran Cleric",Human Elf Cleric,2.0,B,"DeathtouchSpecialize {2}. Activate only if a player has 13 or less life.At the beginning of your end step, Shadowheart, Sharran Cleric deals 1 damage to each player.","Specialize, Deathtouch",2,2
"Shaile, Dean of Radiance // Embrose, Dean of Shadow",Bird Cleric // Legendary Creature,2.0,"B, W",Missing Oracle Text,"Flying, Vigilance",0,0
Shameless Charlatan,Background,2.0,U,"Commander creatures you own have ""{2}{U}: This creature becomes a copy of another target creature.""",,0,0
"Shanna, Sisay's Legacy",Human Warrior,2.0,"G, W",Shanna can't be the target of abilities your opponents control.Shanna gets +1/+1 for each creature you control.,,0,0
Shao Jun,Human Assassin,3.0,"R, U","Leap Strike — During your turn, Shao Jun has flying and first strike.Rope Dart — Tap two untapped artifacts you control: Shao Jun deals 1 damage to each opponent.","Leap Strike, Rope Dart",3,3
Sharae of Numbing Depths,Merfolk Wizard,4.0,"U, W","When Sharae enters, tap target creature an opponent controls and put a stun counter on it. (If a permanent with a stun counter would become untapped, remove one from it instead.)Whenever you tap one or more untapped creatures your opponents control, draw a card. This ability triggers only once each turn.",,2,3
"Sharkey, Tyrant of the Shire",Avatar Rogue,4.0,"B, U",Activated abilities of lands your opponents control can't be activated unless they're mana abilities.Sharkey has all activated abilities of lands your opponents control except mana abilities.Mana of any type can be spent to activate Sharkey's abilities.,,2,4
"Shauku, Endbringer",Vampire,7.0,B,"FlyingShauku can't attack if there's another creature on the battlefield.At the beginning of your upkeep, you lose 3 life.{T}: Exile target creature and put a +1/+1 counter on Shauku.",Flying,5,5
"Shaun & Rebecca, Agents",Human Assassin Scientist,4.0,"G, U, W","VigilanceWhen Shaun & Rebecca enters, search your graveyard, hand, and library for a card named The Animus and put it onto the battlefield, then shuffle.{T}: Add {C}. When you do, mill two cards.","Vigilance, Mill",4,4
"Shelob, Dread Weaver",Spider Demon,4.0,B,"Whenever a nontoken creature an opponent controls dies, exile it.{2}{B}, Put a creature card exiled with Shelob into its owner's graveyard: Put two +1/+1 counters on Shelob. Draw a card.{X}{1}{B}: Put target creature card with mana value X exiled with Shelob onto the battlefield tapped under your control.",,3,3
Sheoldred // The True Scriptures,Phyrexian Praetor // Enchantment,5.0,B,Missing Oracle Text,"Transform, Menace, Mill",0,0
"Shiko and Narset, Unified",Human Spirit Dragon,4.0,"R, U, W","Flying, vigilanceFlurry — Whenever you cast your second spell each turn, copy that spell if it targets a permanent or player, and you may choose new targets for the copy. If you don't copy a spell this way, draw a card.","Flying, Vigilance",4,4
Shimatsu the Bloodcloaked,Demon Spirit,4.0,R,"As Shimatsu enters, sacrifice any number of permanents. Shimatsu enters with that many +1/+1 counters on it.",,0,0
"Shizuko, Caller of Autumn",Snake Shaman,3.0,G,"At the beginning of each player's upkeep, that player adds {G}{G}{G}. Until end of turn, they don't lose this mana as steps and phases end.",,2,3
"Siani, Eye of the Storm",Djinn Monk,4.0,U,"FlyingWhenever Siani attacks, scry X, where X is the number of attacking creatures with flying.Partner (You can have two commanders if both have partner.)","Scry, Flying, Partner",3,2
Sidar Jabari,Human Knight,4.0,W,"Flanking (Whenever a creature without flanking blocks this creature, the blocking creature gets -1/-1 until end of turn.)Whenever Sidar Jabari attacks, tap target creature defending player controls.",Flanking,2,2
Sidar Kondo of Jamuraa,Human Knight,4.0,"G, W","Flanking (Whenever a creature without flanking blocks this creature, the blocking creature gets -1/-1 until end of turn.)Creatures your opponents control without flying or reach can't block creatures with power 2 or less.Partner (You can have two commanders if both have partner.)","Flanking, Partner",2,5
"Sidisi, Regent of the Mire",Zombie Snake Warlock,2.0,B,"{T}, Sacrifice a creature you control with mana value X other than Sidisi: Return target creature card with mana value X plus 1 from your graveyard to the battlefield. Activate only as a sorcery.",,1,3
"Sigarda, Heron's Grace",Angel,5.0,"G, W","FlyingYou and Humans you control have hexproof.{2}, Exile a card from your graveyard: Create a 1/1 white Human Soldier creature token.",Flying,4,5
"Sigarda, Host of Herons",Angel,5.0,"G, W","Flying, hexproofSpells and abilities your opponents control can't cause you to sacrifice permanents.","Flying, Hexproof",5,5
"Sigrid, God-Favored",Human Warrior,3.0,W,"FlashFirst strike, protection from God creaturesWhen Sigrid enters, exile up to one target attacking or blocking creature until Sigrid leaves the battlefield.","First strike, Protection, Flash",2,2
"Silas Renn, Seeker Adept",Human,3.0,"B, U","DeathtouchWhenever Silas Renn deals combat damage to a player, choose target artifact card in your graveyard. You may cast that card this turn.Partner (You can have two commanders if both have partner.)","Partner, Deathtouch",2,2
"Silvar, Devourer of the Free",Cat Nightmare,5.0,"B, R","Partner with Trynn, Champion of Freedom (When this creature enters, target player may put Trynn into their hand from their library, then shuffle.)MenaceSacrifice a Human: Put a +1/+1 counter on Silvar. It gains indestructible until end of turn.","Partner with, Partner, Menace",4,2
"Silvos, Rogue Elemental",Elemental,6.0,G,Trample{G}: Regenerate Silvos.,Trample,8,5
"Sima Yi, Wei Field Marshal",Human Soldier,6.0,B,Sima Yi's power is equal to the number of Swamps you control.,,0,4
"Sin, Spira's Punishment",Leviathan Avatar,7.0,"B, G, U","FlyingWhenever Sin enters or attacks, exile a permanent card from your graveyard at random, then create a tapped token that's a copy of that card. If the exiled card is a land card, repeat this process.",Flying,7,7
"Siona, Captain of the Pyleas",Human Soldier,3.0,"G, W","When Siona enters, look at the top seven cards of your library. You may reveal an Aura card from among them and put it into your hand. Put the rest on the bottom of your library in a random order.Whenever an Aura you control becomes attached to a creature you control, create a 1/1 white Human Soldier creature token.",,2,2
Sir Shandlar of Eberyn,Human Knight,6.0,"G, W",,,4,7
"Sivriss, Nightmare Speaker",Snake Cleric Warlock,4.0,B,"{T}, Sacrifice another creature or an artifact: For each opponent, you mill a card, then return that card from your graveyard to your hand unless that player pays 3 life. (To mill a card, put the top card of your library into your graveyard.)Choose a Background (You can have a Background as a second commander.)","Choose a background, Mill",3,3
Skanos Dragonheart,Dragon Ranger,5.0,G,"Whenever Skanos Dragonheart attacks, it gets +X/+X until end of turn, where X is the greatest power among other Dragons you control and Dragon cards in your graveyard.Choose a Background (You can have a Background as a second commander.)",Choose a background,4,4
"Skanos, Dragon Vassal",Dragon Ranger,5.0,G,"Specialize {4}Whenever Skanos, Dragon Vassal attacks, another target attacking creature gets +X/+0 until end of turn, where X is Skanos's power.",Specialize,4,4
"Skoa, Embermage",Goblin Wizard,6.0,R,"When Skoa enters, it deals 4 damage to any target.Grandeur — Discard another card named Skoa, Embermage, Sacrifice two Mountains: Skoa deals 4 damage to any target.",Grandeur,4,4
"Slicer, Hired Muscle // Slicer, High-Speed Antagonist",Robot // Legendary Artifact,5.0,R,Missing Oracle Text,"Goad, Living metal, First strike, Haste, Convert, More Than Meets the Eye, Double strike",0,0
"Slimefoot, Thallid Transplant",Fungus,2.0,"B, G","Whenever a Swamp or Forest enters under your control, draft a card from Slimefoot, Thallid Transplant's spellbook.",,2,2
"Slobad, Goblin Tinkerer",Goblin Artificer,2.0,R,Sacrifice an artifact: Target artifact gains indestructible until end of turn.,,1,2
"Slobad, Iron Goblin",Phyrexian Goblin Artificer,3.0,R,"{T}, Sacrifice an artifact: Add an amount of {R} equal to the sacrificed artifact's mana value. Spend this mana only to cast artifact spells or activate abilities of artifacts.",,3,3
"Solaflora, Intergalactic Icon",Human Guest,5.0,W,"Auras and Equipment you control attached to Solaflora, Intergalactic Icon affect other creatures you control as though those Auras and Equipment were attached to them.Counters and stickers on Solaflora affect other creatures you control as though those counters and stickers were on them.",,3,3
"Sophina, Spearsage Deserter",Human Soldier,4.0,"R, W","MenaceWhenever Sophina, Spearsage Deserter attacks, investigate once for each nontoken attacking creature. (To investigate, create a Clue token. It's an artifact with ""{2}, Sacrifice this artifact: Draw a card."")Friends forever (You can have two commanders if both have friends forever.)","Investigate, Menace, Friends forever",4,4
"Soramaro, First to Dream",Spirit,6.0,U,"FlyingSoramaro's power and toughness are each equal to the number of cards in your hand.{4}, Return a land you control to its owner's hand: Draw a card.",Flying,0,0
"Sorin of House Markov // Sorin, Ravenous Neonate",Human Noble // Legendary Planeswalker,2.0,"B, W",Missing Oracle Text,"Lifelink, Extort, Transform, Food",0,0
"Soundwave, Sonic Spy // Soundwave, Superior Captain",Robot // Legendary Artifact,4.0,"B, U, W",Missing Oracle Text,"Convert, More Than Meets the Eye",0,0
"Spike, Tournament Grinder",Human Gamer,4.0,B,({B/P} can be paid with either {B} or 2 life.){B/P}{B/P}{B/P}{B/P}: Reveal a card you own from outside the game that has been banned or restricted in a Constructed format and put it into your hand.,,1,1
"Squee, Dubious Monarch",Goblin Noble,3.0,R,"HasteWhenever Squee attacks, create a 1/1 red Goblin creature token that's tapped and attacking.You may cast this card from your graveyard by paying {3}{R} and exiling four other cards from your graveyard rather than paying its mana cost.",Haste,2,2
"Squee, Goblin Nabob",Goblin,3.0,R,"At the beginning of your upkeep, you may return this card from your graveyard to your hand.",,1,1
Stangg,Human Warrior,6.0,"G, R","When Stangg enters, create Stangg Twin, a legendary 3/4 red and green Human Warrior creature token. Exile that token when Stangg leaves the battlefield. Sacrifice Stangg when that token leaves the battlefield.",,3,4
Starke of Rath,Human Rogue,3.0,R,{T}: Destroy target artifact or creature. That permanent's controller gains control of Starke. (This effect lasts indefinitely.),,2,2
"Starscream, Power Hungry // Starscream, Seeker Leader",Robot // Legendary Artifact,4.0,B,Missing Oracle Text,"Flying, Living metal, Haste, Convert, Menace, More Than Meets the Eye",0,0
"Stet, Draconic Proofreader",Dragon Bureaucrat,6.0,"R, W","FlyingWhenever Stet attacks, you may exile a card from your graveyard. When you do, Stet deals 4 damage to any target whose name begins with the same letter as the exiled card.{W}: Delete the first letter of target permanent or player's name until end of turn.",Flying,4,4
Stitcher Geralf,Human Wizard,5.0,U,"{2}{U}, {T}: Each player mills three cards. Exile up to two creature cards put into graveyards this way. Create an X/X blue Zombie creature token, where X is the total power of the cards exiled this way.",Mill,3,4
"Stonebrow, Krosan Hero",Centaur Warrior,5.0,"G, R","TrampleWhenever a creature you control with trample attacks, it gets +2/+2 until end of turn.",Trample,4,4
"Strax, Sontaran Nurse",Alien Cleric,5.0,"G, R","Vigilance, trampleGrenades! — {2}, {T}, Sacrifice an artifact: Choose a player at random. When you do, Strax fights another target creature that player controls.Glory of Battle — Whenever Strax deals damage to a creature, put a +1/+1 counter on Strax.","Vigilance, Glory of Battle, Trample, Fight, Grenades!",5,5
Street Urchin,Background,2.0,R,"Commander creatures you own have ""{1}, Sacrifice another creature or an artifact: This creature deals 1 damage to any target.""",,0,0
"Strider, Ranger of the North",Human Ranger,4.0,"G, R","Landfall — Whenever a land you control enters, target creature gets +1/+1 until end of turn. Then if that creature has power 4 or greater, it gains first strike until end of turn.",Landfall,4,4
"Sun Ce, Young Conquerer",Human Soldier,5.0,U,"Horsemanship (This creature can't be blocked except by creatures with horsemanship.)When Sun Ce enters, you may return target creature to its owner's hand.",Horsemanship,3,3
"Sundial, Dawn Tyrant",Construct,2.0,W,,,3,3
Surgeon General Commander,Wombat Bat Chameleon,4.0,"B, G, R, U, W","Whenever you augment, enchant, or mutate a creature you control, draw a card.{T}: Add {W}, {U}, {B}, {R}, or {G}.",Enchant,3,3
"Surrak, Elusive Hunter",Human Warrior,3.0,G,"This spell can't be countered.TrampleWhenever a creature you control or a creature spell you control becomes the target of a spell or ability an opponent controls, draw a card.",Trample,4,3
"Surrak, the Hunt Caller",Human Warrior,4.0,G,"Formidable — At the beginning of combat on your turn, if creatures you control have total power 8 or greater, target creature you control gains haste until end of turn. (It can attack and {T} no matter when it came under your control.)",Formidable,5,4
"Surtr, Fiery Jotun",Giant God Warrior,5.0,R,"Trample (This creature can deal excess combat damage to the player it's attacking.)Whenever you cast a historic spell, Surtr deals 3 damage to any target. (Artifacts, legendaries, and Sagas are historic.)",Trample,5,5
Susan Foreman,Time Lord,2.0,G,"If you would planeswalk, instead look at the top two cards of your planar deck, put one on the bottom of your planar deck and the other on top, then planeswalk.{T}: Add {G}.Doctor's companion (You can have two commanders if the other is the Doctor.)",Doctor's companion,1,1
"Sutina, Speaker of the Tajuru",Elf Scout,3.0,G,"When Sutina enters, search your library for a basic land card, put it onto the battlefield tapped, then shuffle.Whenever Sutina attacks, you may return a land you control to its owner's hand. When you do, put a +1/+1 counter on target creature.",,2,2
Sword Coast Sailor,Background,2.0,U,"Commander creatures you own have ""Whenever this creature attacks a player, if no opponent has more life than that player, this creature can't be blocked this turn.""",,0,0
Sylvia Brightspear,Human Knight,3.0,W,"Partner with Khorvath Brightflame (When this creature enters, target player may put Khorvath into their hand from their library, then shuffle.)Double strikeDragons your team controls have double strike.","Partner with, Partner, Double strike",2,2
"Syr Alin, the Lion's Claw",Human Knight,5.0,W,"First strike (This creature deals combat damage before creatures without first strike.)Whenever Syr Alin attacks, other creatures you control get +1/+1 until end of turn.",First strike,4,4
"Syr Cadian, Knight Owl",Bird Knight,5.0,"B, W",Knightlifelink (Damage dealt by Knights you control also causes you to gain that much life.){W}: Syr Cadian gains vigilance until end of turn. Activate only from sunrise to sunset.{B}: Syr Cadian gains flying until end of turn. Activate only from sunset to sunrise.,,4,4
"Syr Elenora, the Discerning",Human Knight,5.0,U,"Syr Elenora's power is equal to the number of cards in your hand.When Syr Elenora enters, draw a card.Spells your opponents cast that target Syr Elenora cost {2} more to cast.",,0,4
"Syr Faren, the Hengehammer",Human Knight,2.0,G,"Whenever Syr Faren attacks, another target attacking creature gets +X/+X until end of turn, where X is Syr Faren's power.",,2,2
Syr Joshua and Syr Saxon,Human Knight,2.0,"G, W","Double teamIf you control exactly two legendary permanents named Syr Joshua and Syr Saxon, the ""legend rule"" doesn't apply to them.Each other creature you control named Syr Joshua and Syr Saxon has battle cry.",,2,3
